{"admission_checks":{"all_domains_joint_interval_upper_at_most_0_05":true,"calibration_all_domains":false,"four_domains_improve_joint_point_against_both_comparators":true,"joint_interval_upper_below_zero_vs_reference":true,"joint_interval_upper_below_zero_vs_v5":false,"one_x_two_brier_noninferior_vs_reference":true,"one_x_two_brier_noninferior_vs_v5":true,"one_x_two_interval_upper_at_most_zero_vs_reference":true,"one_x_two_interval_upper_at_most_zero_vs_v5":true,"one_x_two_rps_noninferior_vs_reference":true,"one_x_two_rps_noninferior_vs_v5":true,"total_goal_crps_noninferior_vs_reference":true,"total_goal_crps_noninferior_vs_v5":true},"artifact_round_trip":"PASS_EXACT_PREDICTION_EQUALITY","calibration":{"bundesliga_2024_25":{"candidate":{"away":{"ece_10_fixed_bins":0.05488300141308942,"intercept":0.040678922166490536,"intercept_95_interval":[-0.44433152552288646,0.5256893698558676],"slope":0.8206838984310723,"slope_95_interval":[0.20245770834300358,1.4389100885191408]},"draw":{"ece_10_fixed_bins":0.052186741440549876,"intercept":0.6738971067290938,"intercept_95_interval":[-1.85651933704953,3.2043135505077176],"slope":1.4305389106532866,"slope_95_interval":[-0.8591009415879396,3.7201787628945127]},"home":{"ece_10_fixed_bins":0.10056361416300577,"intercept":-0.14351472812311933,"intercept_95_interval":[-0.5689483169015005,0.28191886065526184],"slope":1.5417835717731438,"slope_95_interval":[0.8135855992942714,2.2699815442520164]}},"reference":{"away":{"ece_10_fixed_bins":0.05761118922436597,"intercept":-0.020946420313736603,"intercept_95_interval":[-0.5615351141325898,0.5196422735051166],"slope":0.7258967078201715,"slope_95_interval":[-0.009777675186790624,1.4615710908271335]},"draw":{"ece_10_fixed_bins":0.042409880257355634,"intercept":-1.1495473908923928,"intercept_95_interval":[-3.8227775813182214,1.5236827995334359],"slope":-0.2343399000974608,"slope_95_interval":[-2.757075690397878,2.288395890202956]},"home":{"ece_10_fixed_bins":0.06099751757936311,"intercept":-0.19690484185910548,"intercept_95_interval":[-0.6730636351082374,0.2792539513900265],"slope":1.1769947925355306,"slope_95_interval":[0.36745142335287717,1.986538161718184]}},"v5":{"away":{"ece_10_fixed_bins":0.03011575871852636,"intercept":0.08397986092627299,"intercept_95_interval":[-0.4329951967445692,0.6009549185971151],"slope":0.9104025576756304,"slope_95_interval":[0.2123110483734597,1.608494066977801]},"draw":{"ece_10_fixed_bins":0.039838927710387266,"intercept":0.3068108390523512,"intercept_95_interval":[-2.122103312042975,2.7357249901476774],"slope":1.134840075195549,"slope_95_interval":[-1.131925133215772,3.40160528360687]},"home":{"ece_10_fixed_bins":0.07522782626605504,"intercept":-0.12641311367894373,"intercept_95_interval":[-0.5810098944010605,0.32818366704317303],"slope":1.4035046904482171,"slope_95_interval":[0.6280766807301629,2.1789327001662713]}}},"bundesliga_2025_26":{"candidate":{"away":{"ece_10_fixed_bins":0.06294087964480997,"intercept":-0.1924959931497489,"intercept_95_interval":[-0.5926444810463493,0.20765249474685143],"slope":1.1135284131973264,"slope_95_interval":[0.5762173559498152,1.6508394704448377]},"draw":{"ece_10_fixed_bins":0.03261271731622607,"intercept":0.8160772432207314,"intercept_95_interval":[-1.1852107777169287,2.8173652641583917],"slope":1.5604589727715967,"slope_95_interval":[-0.1369770282790126,3.2578949738222063]},"home":{"ece_10_fixed_bins":0.07135437671476634,"intercept":0.16150057466777565,"intercept_95_interval":[-0.17705382202912087,0.5000549713646721],"slope":1.1843619335933548,"slope_95_interval":[0.6870335337275211,1.6816903334591886]}},"reference":{"away":{"ece_10_fixed_bins":0.060581496907173044,"intercept":-0.08059565102359909,"intercept_95_interval":[-0.5305803879447943,0.3693890858975962],"slope":1.250840237146098,"slope_95_interval":[0.6257326004558529,1.8759478738363433]},"draw":{"ece_10_fixed_bins":0.01840431334832039,"intercept":0.7211875222251656,"intercept_95_interval":[-1.6356353561978871,3.0780104006482185],"slope":1.5598581865259231,"slope_95_interval":[-0.5437413644378186,3.663457737489665]},"home":{"ece_10_fixed_bins":0.07975502851278451,"intercept":0.32422590689933045,"intercept_95_interval":[-0.046178070029924356,0.6946298838285853],"slope":1.54551905524342,"slope_95_interval":[0.9278336278056217,2.163204482681218]}},"v5":{"away":{"ece_10_fixed_bins":0.06690131631792111,"intercept":-0.13329515475595075,"intercept_95_interval":[-0.5468510296775038,0.2802607201656022],"slope":1.2219515144158724,"slope_95_interval":[0.6523890788511332,1.7915139499806116]},"draw":{"ece_10_fixed_bins":0.023658816646552693,"intercept":0.9209895623644352,"intercept_95_interval":[-1.085447853000761,2.927426977729631],"slope":1.699406973176249,"slope_95_interval":[-0.055701499938886956,3.454515446291385]},"home":{"ece_10_fixed_bins":0.06634444467445241,"intercept":0.25012677386157817,"intercept_95_interval":[-0.10629942879519694,0.6065529765183533],"slope":1.3402989537306382,"slope_95_interval":[0.7960825802330099,1.8845153272282666]}}},"la_liga_2024_25":{"candidate":{"away":{"ece_10_fixed_bins":0.05546600777165287,"intercept":-0.06613651764250676,"intercept_95_interval":[-0.4527321431027023,0.32045910781768877],"slope":1.1391650030240041,"slope_95_interval":[0.6715748348765171,1.6067551711714911]},"draw":{"ece_10_fixed_bins":0.030014012295776372,"intercept":0.2016775429572242,"intercept_95_interval":[-1.6429124455430213,2.04626753145747],"slope":1.0435898368199654,"slope_95_interval":[-0.46719167920427496,2.554371352844206]},"home":{"ece_10_fixed_bins":0.061661202622377044,"intercept":0.052535506478904745,"intercept_95_interval":[-0.2669332502753861,0.37200426323319563],"slope":1.1719117947114515,"slope_95_interval":[0.7123325841300487,1.6314910052928542]}},"reference":{"away":{"ece_10_fixed_bins":0.05336863060462788,"intercept":0.2857014358604578,"intercept_95_interval":[-0.20686808175656196,0.7782709534774777],"slope":1.7356887613412795,"slope_95_interval":[1.0094835932262811,2.461893929456278]},"draw":{"ece_10_fixed_bins":0.0368317555930647,"intercept":0.6737008904988483,"intercept_95_interval":[-2.0202606662117986,3.367662447209495],"slope":1.4951803747251797,"slope_95_interval":[-0.8162832979483565,3.806644047398716]},"home":{"ece_10_fixed_bins":0.035557710367019844,"intercept":0.16374210941043207,"intercept_95_interval":[-0.19283557846940755,0.5203197972902717],"slope":1.3898011599777946,"slope_95_interval":[0.7497470403796299,2.0298552795759592]}},"v5":{"away":{"ece_10_fixed_bins":0.055512416720317634,"intercept":0.09074406685283713,"intercept_95_interval":[-0.3292407800811214,0.5107289137867956],"slope":1.4097008990502624,"slope_95_interval":[0.8513364423025753,1.9680653557979495]},"draw":{"ece_10_fixed_bins":0.030389029371662147,"intercept":0.11267620534368682,"intercept_95_interval":[-1.6906786054539713,1.9160310161413447],"slope":0.9947795535472611,"slope_95_interval":[-0.5171306019135476,2.5066897090080698]},"home":{"ece_10_fixed_bins":0.07233030787873664,"intercept":0.08878744399161391,"intercept_95_interval":[-0.24127885840123725,0.4188537463844651],"slope":1.2201426727255633,"slope_95_interval":[0.7159798448663824,1.724305500584744]}}},"premier_league_2024_25":{"candidate":{"away":{"ece_10_fixed_bins":0.06990611218423305,"intercept":0.5227361529281892,"intercept_95_interval":[0.040370565146165494,1.005101740710213],"slope":1.499181848027151,"slope_95_interval":[0.9211540430540787,2.0772096530002235]},"draw":{"ece_10_fixed_bins":0.03017871883233192,"intercept":-1.2688393091052421,"intercept_95_interval":[-3.448947882027243,0.9112692638167585],"slope":-0.00028836565354474735,"slope_95_interval":[-1.8939844427030506,1.8934077113959609]},"home":{"ece_10_fixed_bins":0.05217762466163687,"intercept":0.0766947002960705,"intercept_95_interval":[-0.26044624507925546,0.41383564567139647],"slope":1.5819645230982973,"slope_95_interval":[0.9937522983654904,2.1701767478311043]}},"reference":{"away":{"ece_10_fixed_bins":0.04957534978356516,"intercept":0.5719929225747943,"intercept_95_interval":[0.04170526855486112,1.1022805765947274],"slope":1.5832061816044134,"slope_95_interval":[0.9140734230436253,2.2523389401652016]},"draw":{"ece_10_fixed_bins":0.025046731295853726,"intercept":-1.152955787510535,"intercept_95_interval":[-3.96438196257425,1.65847038755318],"slope":0.10208585141372348,"slope_95_interval":[-2.365509715719659,2.5696814185471055]},"home":{"ece_10_fixed_bins":0.045178085085958344,"intercept":0.059205719310430664,"intercept_95_interval":[-0.2819279440871238,0.40033938270798514],"slope":1.4530824248548126,"slope_95_interval":[0.8034690543425952,2.10269579536703]}},"v5":{"away":{"ece_10_fixed_bins":0.07413450299568727,"intercept":0.6290638337729001,"intercept_95_interval":[0.10473217336957474,1.1533954941762254],"slope":1.66338779948736,"slope_95_interval":[1.0050493035082937,2.3217262954664264]},"draw":{"ece_10_fixed_bins":0.02656431043368654,"intercept":-1.769781352907156,"intercept_95_interval":[-4.243052405382349,0.7034896995680366],"slope":-0.4437831842908752,"slope_95_interval":[-2.608371888883226,1.7208055203014756]},"home":{"ece_10_fixed_bins":0.06420382720421729,"intercept":0.10727028352926084,"intercept_95_interval":[-0.23763220646485855,0.4521727735233802],"slope":1.6253980111186077,"slope_95_interval":[0.9762064875777927,2.2745895346594227]}}},"serie_a_2024_25":{"candidate":{"away":{"ece_10_fixed_bins":0.07757292385741014,"intercept":0.07265408806963644,"intercept_95_interval":[-0.3547917228476747,0.5000998989869475],"slope":1.473101654669872,"slope_95_interval":[0.9143268037002602,2.031876505639484]},"draw":{"ece_10_fixed_bins":0.058139964208698706,"intercept":1.8671686151794409,"intercept_95_interval":[-0.551876027237048,4.2862132575959295],"slope":2.3473522037022856,"slope_95_interval":[0.2712149028145858,4.423489504589986]},"home":{"ece_10_fixed_bins":0.05868640875460064,"intercept":0.022864442812672803,"intercept_95_interval":[-0.3044485228630144,0.35017740848836],"slope":1.448780